[
  {
    "id": "viet1252-quocngu",
    "name": "Vietnamese Quốc Ngữ (Saigon dialect)",
    "script": "Latin",
    "direction": "ltr",
    "status": "current",
    "period": {
      "from": 1910,
      "to": null
    },
    "region": "Southern Vietnam (Ho Chi Minh City region)",
    "description": "Latin-based Vietnamese orthography with tone diacritics, representing the Saigon (Southern Vietnamese) dialect pronunciation. This variety is characterized by specific phonetic realizations that may differ from Northern (Hanoi) and Central Vietnamese dialects.",
    "source": {
      "title": "Vietnamese Phonology and Orthography: Southern Dialect",
      "author": "Various linguistic sources",
      "year": 2025,
      "url": "https://en.wikipedia.org/wiki/Vietnamese_alphabet"
    }
  }
]
